{
  "name": "@orqastudio/plugin-typescript",
  "displayName": "TypeScript",
  "version": "0.1.4-dev",
  "description": "Base TypeScript development infrastructure — tsconfig presets, ESLint configs, and config composition for plugin extensions.",
  "category": "domain-knowledge",
  "purpose": ["domain-knowledge", "infrastructure"],
  "affects_schema": false,
  "affects_enforcement": true,
  "content": {
    "documentation": {
      "source": "documentation",
      "target": ".orqa/documentation"
    },
    "knowledge": {
      "source": "knowledge",
      "target": ".orqa/documentation/knowledge"
    }
  },
  "dependencies": {
    "npm": [
      "@typescript-eslint/eslint-plugin",
      "@typescript-eslint/parser",
      "typescript-eslint",
      "typescript-language-server"
    ]
  },
  "build": "npm run build",
  "provides": {
    "enforcement_mechanisms": [
      {
        "key": "tsc",
        "description": "TypeScript type checking",
        "strength": 6
      }
    ],
    "knowledge": [
      {
        "key": "typescript-advanced-types",
        "id": "KNOW-TS-001",
        "label": "TypeScript Advanced Types"
      },
      {
        "key": "40e2eb99",
        "id": "KNOW-40e2eb99",
        "label": "TypeScript Advanced Types"
      }
    ],
    "lspServers": {
      "typescript": {
        "command": "typescript-language-server",
        "args": [
          "--stdio"
        ],
        "extensionToLanguage": {
          ".ts": "typescript",
          ".tsx": "typescriptreact",
          ".js": "javascript",
          ".jsx": "javascriptreact"
        }
      }
    },
    "configPresets": {
      "tsconfig": [
        {
          "name": "base",
          "path": "src/tsconfig/base.json",
          "description": "Strict TypeScript defaults"
        },
        {
          "name": "library",
          "path": "src/tsconfig/library.json",
          "description": "Library preset (NodeNext, declarations)"
        },
        {
          "name": "app",
          "path": "src/tsconfig/app.json",
          "description": "App preset (bundler resolution, no emit)"
        }
      ],
      "eslint": [
        {
          "name": "base",
          "import": "@orqastudio/plugin-typescript/eslint",
          "export": "base"
        },
        {
          "name": "recommended",
          "import": "@orqastudio/plugin-typescript/eslint",
          "export": "recommended"
        }
      ]
    },
    "knowledge_declarations": [
      {
        "id": "typescript-advanced-types",
        "tier": "on-demand",
        "roles": [
          "implementer"
        ],
        "paths": [
          "**/*.ts"
        ],
        "tags": [
          "typescript",
          "advanced-types",
          "generics"
        ],
        "priority": "P3",
        "summary": "TypeScript advanced types: generics, conditional types, mapped types, template literals, utility types. For complex type logic and compile-time type safety.",
        "content_file": "../../.orqa/documentation/knowledge/KNOW-40e2eb99.md"
      }
    ]
  }
}
